{
  "$schema": "http://json-schema.org/draft-07/schema#",
  "type": "object",
  "required": ["phase", "status", "timestamp", "git", "rules", "summary"],
  "properties": {
    "phase": {"type": "string", "pattern": "^[0-9]{2}$"},
    "status": {"type": "string", "enum": ["PASS", "FAIL", "PENDING"]},
    "timestamp": {"type": "string"},
    "git": {
      "type": "object",
      "required": ["commit", "branch"],
      "properties": {
        "commit": {"type": "string"},
        "branch": {"type": "string"}
      }
    },
    "rules": {
      "type": "array",
      "items": {
        "type": "object",
        "required": ["id", "name", "status", "critical", "warnings"],
        "properties": {
          "id": {"type": "string", "pattern": "^R[0-9]{2}$"},
          "name": {"type": "string"},
          "status": {"type": "string", "enum": ["PASS", "FAIL", "SKIP"]},
          "critical": {"type": "integer", "minimum": 0},
          "warnings": {"type": "integer", "minimum": 0},
          "message": {"type": "string"}
        }
      }
    },
    "summary": {
      "type": "object",
      "required": ["total", "pass", "fail", "skip", "critical", "warnings", "pass_rate"],
      "properties": {
        "total": {"type": "integer", "minimum": 0},
        "pass": {"type": "integer", "minimum": 0},
        "fail": {"type": "integer", "minimum": 0},
        "skip": {"type": "integer", "minimum": 0},
        "critical": {"type": "integer", "minimum": 0},
        "warnings": {"type": "integer", "minimum": 0},
        "pass_rate": {"type": "number", "minimum": 0, "maximum": 100}
      }
    },
    "violations": {
      "type": "array",
      "items": {
        "type": "object",
        "required": ["rule", "severity", "message"],
        "properties": {
          "rule": {"type": "string"},
          "severity": {"type": "string", "enum": ["CRITICAL", "WARNING"]},
          "file": {"type": "string"},
          "line": {"type": "integer", "minimum": 1},
          "message": {"type": "string"}
        }
      }
    }
  }
}
